{
  "$schema": "https://json-schema.org/draft/2020-12/schema",
  "$id": "https://agentkit.dev/schemas/concept-toolchain/projection-receipt.schema.json",
  "title": "promotion/receipts/<receipt_id>.json \u2014 projection receipt (FK-78 section 78.10)",
  "type": "object",
  "required": [
    "schema_version",
    "receipt_id",
    "atom_id",
    "target",
    "target_mode",
    "selector",
    "source_digest",
    "target_section_digest",
    "writer_principal_id",
    "writer_session_ref",
    "reviewer_principal_id",
    "reviewer_session_ref",
    "verdict",
    "reviewed_at"
  ],
  "additionalProperties": false,
  "properties": {
    "schema_version": {
      "type": "string",
      "pattern": "^1\\.\\d+\\.\\d+$"
    },
    "receipt_id": {
      "type": "string",
      "pattern": "^RCP-[0-9a-f]{8}-\\d{4,}$"
    },
    "atom_id": {
      "type": "string",
      "pattern": "^ATM-[0-9a-f]{8}-\\d{4,}$"
    },
    "target": {
      "type": "object",
      "required": [
        "path",
        "anchor"
      ],
      "additionalProperties": false,
      "properties": {
        "path": {
          "type": "string",
          "minLength": 1
        },
        "anchor": {
          "type": "string"
        }
      }
    },
    "target_mode": {
      "type": "string",
      "enum": [
        "markdown-section",
        "whole-file",
        "structured-selector",
        "directory-tree"
      ]
    },
    "selector": {
      "type": [
        "string",
        "null"
      ],
      "minLength": 1
    },
    "source_digest": {
      "type": "string",
      "pattern": "^[0-9a-f]{64}$"
    },
    "target_section_digest": {
      "type": "string",
      "pattern": "^[0-9a-f]{64}$"
    },
    "writer_principal_id": {
      "type": "string",
      "pattern": "^[a-z0-9]+([._-][a-z0-9]+)*$"
    },
    "writer_session_ref": {
      "type": "string",
      "minLength": 1
    },
    "reviewer_principal_id": {
      "type": "string",
      "pattern": "^[a-z0-9]+([._-][a-z0-9]+)*$"
    },
    "reviewer_session_ref": {
      "type": "string",
      "minLength": 1
    },
    "verdict": {
      "type": "string",
      "enum": [
        "equivalent",
        "disagrees"
      ]
    },
    "reviewed_at": {
      "type": "string",
      "pattern": "^\\d{4}-\\d{2}-\\d{2}T\\d{2}:\\d{2}:\\d{2}(\\.\\d{1,9})?Z$"
    }
  }
}
